{
  "id": "qt",
  "name": "Qt 6",
  "category": "Languages",
  "description": "Cross-platform application development framework for desktop, embedded and mobile systems.",
  "icon": "qt",
  "format": "dash",
  "latest_version": "6.11",
  "latest_lts_version": "6.8",
  "versions": [
    {
      "version": "6.11",
      "display_name": "v6.11 (6.11.2)",
      "is_lts": false,
      "is_eol": false,
      "is_latest": true,
      "release_date": "2026-03-23",
      "download_url": "https://github.com/falconwasplaying/coldmanual-db/raw/main/manuals/qt.tgz",
      "size_bytes": 200753107
    },
    {
      "version": "6.10",
      "display_name": "v6.10 (6.10.3)",
      "is_lts": false,
      "is_eol": false,
      "is_latest": false,
      "release_date": "2025-10-07",
      "download_url": "https://github.com/falconwasplaying/coldmanual-db/raw/main/manuals/qt.tgz",
      "size_bytes": 200753107
    },
    {
      "version": "6.9",
      "display_name": "v6.9 (6.9.3)",
      "is_lts": false,
      "is_eol": true,
      "is_latest": false,
      "release_date": "2025-04-02",
      "download_url": "https://github.com/falconwasplaying/coldmanual-db/raw/main/manuals/qt.tgz",
      "size_bytes": 200753107
    },
    {
      "version": "6.8",
      "display_name": "v6.8 (6.8.3)",
      "is_lts": true,
      "is_eol": false,
      "is_latest": false,
      "release_date": "2024-10-07",
      "download_url": "https://github.com/falconwasplaying/coldmanual-db/raw/main/manuals/qt.tgz",
      "size_bytes": 200753107
    },
    {
      "version": "6.7",
      "display_name": "v6.7 (6.7.3)",
      "is_lts": false,
      "is_eol": true,
      "is_latest": false,
      "release_date": "2024-03-28",
      "download_url": "https://github.com/falconwasplaying/coldmanual-db/raw/main/manuals/qt.tgz",
      "size_bytes": 200753107
    },
    {
      "version": "6.6",
      "display_name": "v6.6 (6.6.3)",
      "is_lts": false,
      "is_eol": true,
      "is_latest": false,
      "release_date": "2023-10-09",
      "download_url": "https://github.com/falconwasplaying/coldmanual-db/raw/main/manuals/qt.tgz",
      "size_bytes": 200753107
    },
    {
      "version": "6.5",
      "display_name": "v6.5 (6.5.8)",
      "is_lts": true,
      "is_eol": true,
      "is_latest": false,
      "release_date": "2023-03-31",
      "download_url": "https://github.com/falconwasplaying/coldmanual-db/raw/main/manuals/qt.tgz",
      "size_bytes": 200753107
    },
    {
      "version": "6.4",
      "display_name": "v6.4 (6.4.3)",
      "is_lts": false,
      "is_eol": true,
      "is_latest": false,
      "release_date": "2022-09-28",
      "download_url": "https://github.com/falconwasplaying/coldmanual-db/raw/main/manuals/qt.tgz",
      "size_bytes": 200753107
    },
    {
      "version": "6.3",
      "display_name": "v6.3 (6.3.2)",
      "is_lts": false,
      "is_eol": true,
      "is_latest": false,
      "release_date": "2022-04-11",
      "download_url": "https://github.com/falconwasplaying/coldmanual-db/raw/main/manuals/qt.tgz",
      "size_bytes": 200753107
    },
    {
      "version": "6.2",
      "display_name": "v6.2 (6.2.4)",
      "is_lts": true,
      "is_eol": true,
      "is_latest": false,
      "release_date": "2021-09-30",
      "download_url": "https://github.com/falconwasplaying/coldmanual-db/raw/main/manuals/qt.tgz",
      "size_bytes": 200753107
    },
    {
      "version": "6.1",
      "display_name": "v6.1 (6.1.3)",
      "is_lts": false,
      "is_eol": true,
      "is_latest": false,
      "release_date": "2021-05-05",
      "download_url": "https://github.com/falconwasplaying/coldmanual-db/raw/main/manuals/qt.tgz",
      "size_bytes": 200753107
    },
    {
      "version": "6.0",
      "display_name": "v6.0 (6.0.4)",
      "is_lts": false,
      "is_eol": true,
      "is_latest": false,
      "release_date": "2020-12-08",
      "download_url": "https://github.com/falconwasplaying/coldmanual-db/raw/main/manuals/qt.tgz",
      "size_bytes": 200753107
    },
    {
      "version": "5.15",
      "display_name": "v5.15 (5.15.17)",
      "is_lts": true,
      "is_eol": true,
      "is_latest": false,
      "release_date": "2020-05-25",
      "download_url": "https://github.com/falconwasplaying/coldmanual-db/raw/main/manuals/qt.tgz",
      "size_bytes": 200753107
    },
    {
      "version": "5.14",
      "display_name": "v5.14 (5.14.2)",
      "is_lts": false,
      "is_eol": true,
      "is_latest": false,
      "release_date": "2019-12-11",
      "download_url": "https://github.com/falconwasplaying/coldmanual-db/raw/main/manuals/qt.tgz",
      "size_bytes": 200753107
    },
    {
      "version": "5.13",
      "display_name": "v5.13 (5.13.2)",
      "is_lts": false,
      "is_eol": true,
      "is_latest": false,
      "release_date": "2019-06-18",
      "download_url": "https://github.com/falconwasplaying/coldmanual-db/raw/main/manuals/qt.tgz",
      "size_bytes": 200753107
    },
    {
      "version": "5.12",
      "display_name": "v5.12 (5.12.12)",
      "is_lts": true,
      "is_eol": true,
      "is_latest": false,
      "release_date": "2018-12-04",
      "download_url": "https://github.com/falconwasplaying/coldmanual-db/raw/main/manuals/qt.tgz",
      "size_bytes": 200753107
    },
    {
      "version": "5.9",
      "display_name": "v5.9 (5.9.9)",
      "is_lts": false,
      "is_eol": true,
      "is_latest": false,
      "release_date": "2017-05-29",
      "download_url": "https://github.com/falconwasplaying/coldmanual-db/raw/main/manuals/qt.tgz",
      "size_bytes": 200753107
    },
    {
      "version": "5.6",
      "display_name": "v5.6 (5.6.3)",
      "is_lts": true,
      "is_eol": true,
      "is_latest": false,
      "release_date": "2016-03-15",
      "download_url": "https://github.com/falconwasplaying/coldmanual-db/raw/main/manuals/qt.tgz",
      "size_bytes": 200753107
    },
    {
      "version": "4.8",
      "display_name": "v4.8 (4.8.7)",
      "is_lts": true,
      "is_eol": true,
      "is_latest": false,
      "release_date": "2011-12-15",
      "download_url": "https://github.com/falconwasplaying/coldmanual-db/raw/main/manuals/qt.tgz",
      "size_bytes": 200753107
    }
  ]
}
