{
  "id": "python",
  "name": "Python",
  "category": "Languages",
  "description": "An interpreted, high-level, general-purpose programming language emphasizing code readability.",
  "icon": "python",
  "format": "dash",
  "latest_version": "3.14",
  "latest_lts_version": "",
  "versions": [
    {
      "version": "3.14",
      "display_name": "v3.14 (3.14.7)",
      "is_lts": false,
      "is_eol": false,
      "is_latest": true,
      "release_date": "2025-10-07",
      "download_url": "https://github.com/falconwasplaying/coldmanual-db/raw/main/manuals/python.tgz",
      "size_bytes": 21302705
    },
    {
      "version": "3.13",
      "display_name": "v3.13 (3.13.15)",
      "is_lts": false,
      "is_eol": false,
      "is_latest": false,
      "release_date": "2024-10-07",
      "download_url": "https://github.com/falconwasplaying/coldmanual-db/raw/main/manuals/python.tgz",
      "size_bytes": 21302705
    },
    {
      "version": "3.12",
      "display_name": "v3.12 (3.12.14)",
      "is_lts": false,
      "is_eol": false,
      "is_latest": false,
      "release_date": "2023-10-02",
      "download_url": "https://github.com/falconwasplaying/coldmanual-db/raw/main/manuals/python.tgz",
      "size_bytes": 21302705
    },
    {
      "version": "3.11",
      "display_name": "v3.11 (3.11.16)",
      "is_lts": false,
      "is_eol": false,
      "is_latest": false,
      "release_date": "2022-10-24",
      "download_url": "https://github.com/falconwasplaying/coldmanual-db/raw/main/manuals/python.tgz",
      "size_bytes": 21302705
    },
    {
      "version": "3.10",
      "display_name": "v3.10 (3.10.21)",
      "is_lts": false,
      "is_eol": false,
      "is_latest": false,
      "release_date": "2021-10-04",
      "download_url": "https://github.com/falconwasplaying/coldmanual-db/raw/main/manuals/python.tgz",
      "size_bytes": 21302705
    },
    {
      "version": "3.9",
      "display_name": "v3.9 (3.9.25)",
      "is_lts": false,
      "is_eol": true,
      "is_latest": false,
      "release_date": "2020-10-05",
      "download_url": "https://github.com/falconwasplaying/coldmanual-db/raw/main/manuals/python.tgz",
      "size_bytes": 21302705
    },
    {
      "version": "3.8",
      "display_name": "v3.8 (3.8.20)",
      "is_lts": false,
      "is_eol": true,
      "is_latest": false,
      "release_date": "2019-10-14",
      "download_url": "https://github.com/falconwasplaying/coldmanual-db/raw/main/manuals/python.tgz",
      "size_bytes": 21302705
    },
    {
      "version": "3.7",
      "display_name": "v3.7 (3.7.17)",
      "is_lts": false,
      "is_eol": true,
      "is_latest": false,
      "release_date": "2018-06-27",
      "download_url": "https://github.com/falconwasplaying/coldmanual-db/raw/main/manuals/python.tgz",
      "size_bytes": 21302705
    },
    {
      "version": "3.6",
      "display_name": "v3.6 (3.6.15)",
      "is_lts": false,
      "is_eol": true,
      "is_latest": false,
      "release_date": "2016-12-23",
      "download_url": "https://github.com/falconwasplaying/coldmanual-db/raw/main/manuals/python.tgz",
      "size_bytes": 21302705
    },
    {
      "version": "3.5",
      "display_name": "v3.5 (3.5.10)",
      "is_lts": false,
      "is_eol": true,
      "is_latest": false,
      "release_date": "2015-09-13",
      "download_url": "https://github.com/falconwasplaying/coldmanual-db/raw/main/manuals/python.tgz",
      "size_bytes": 21302705
    },
    {
      "version": "3.4",
      "display_name": "v3.4 (3.4.10)",
      "is_lts": false,
      "is_eol": true,
      "is_latest": false,
      "release_date": "2014-03-16",
      "download_url": "https://github.com/falconwasplaying/coldmanual-db/raw/main/manuals/python.tgz",
      "size_bytes": 21302705
    },
    {
      "version": "3.3",
      "display_name": "v3.3 (3.3.7)",
      "is_lts": false,
      "is_eol": true,
      "is_latest": false,
      "release_date": "2012-09-29",
      "download_url": "https://github.com/falconwasplaying/coldmanual-db/raw/main/manuals/python.tgz",
      "size_bytes": 21302705
    },
    {
      "version": "3.2",
      "display_name": "v3.2 (3.2.6)",
      "is_lts": false,
      "is_eol": true,
      "is_latest": false,
      "release_date": "2011-02-20",
      "download_url": "https://github.com/falconwasplaying/coldmanual-db/raw/main/manuals/python.tgz",
      "size_bytes": 21302705
    },
    {
      "version": "2.7",
      "display_name": "v2.7 (2.7.18)",
      "is_lts": false,
      "is_eol": true,
      "is_latest": false,
      "release_date": "2010-07-03",
      "download_url": "https://github.com/falconwasplaying/coldmanual-db/raw/main/manuals/python.tgz",
      "size_bytes": 21302705
    },
    {
      "version": "3.1",
      "display_name": "v3.1 (3.1.5)",
      "is_lts": false,
      "is_eol": true,
      "is_latest": false,
      "release_date": "2009-06-27",
      "download_url": "https://github.com/falconwasplaying/coldmanual-db/raw/main/manuals/python.tgz",
      "size_bytes": 21302705
    },
    {
      "version": "3.0",
      "display_name": "v3.0 (3.0.1)",
      "is_lts": false,
      "is_eol": true,
      "is_latest": false,
      "release_date": "2008-12-03",
      "download_url": "https://github.com/falconwasplaying/coldmanual-db/raw/main/manuals/python.tgz",
      "size_bytes": 21302705
    },
    {
      "version": "2.6",
      "display_name": "v2.6 (2.6.9)",
      "is_lts": false,
      "is_eol": true,
      "is_latest": false,
      "release_date": "2008-10-01",
      "download_url": "https://github.com/falconwasplaying/coldmanual-db/raw/main/manuals/python.tgz",
      "size_bytes": 21302705
    }
  ]
}
