{
  "id": "postgresql",
  "name": "PostgreSQL",
  "category": "Databases",
  "description": "A powerful, open source object-relational database system with over 35 years of active development.",
  "icon": "postgresql",
  "format": "dash",
  "latest_version": "18",
  "latest_lts_version": "",
  "versions": [
    {
      "version": "18",
      "display_name": "v18 (18.6)",
      "is_lts": false,
      "is_eol": false,
      "is_latest": true,
      "release_date": "2025-09-25",
      "download_url": "https://github.com/falconwasplaying/coldmanual-db/raw/main/manuals/postgresql.tgz",
      "size_bytes": 4635788
    },
    {
      "version": "17",
      "display_name": "v17 (17.11)",
      "is_lts": false,
      "is_eol": false,
      "is_latest": false,
      "release_date": "2024-09-26",
      "download_url": "https://github.com/falconwasplaying/coldmanual-db/raw/main/manuals/postgresql.tgz",
      "size_bytes": 4635788
    },
    {
      "version": "16",
      "display_name": "v16 (16.15)",
      "is_lts": false,
      "is_eol": false,
      "is_latest": false,
      "release_date": "2023-09-14",
      "download_url": "https://github.com/falconwasplaying/coldmanual-db/raw/main/manuals/postgresql.tgz",
      "size_bytes": 4635788
    },
    {
      "version": "15",
      "display_name": "v15 (15.19)",
      "is_lts": false,
      "is_eol": false,
      "is_latest": false,
      "release_date": "2022-10-13",
      "download_url": "https://github.com/falconwasplaying/coldmanual-db/raw/main/manuals/postgresql.tgz",
      "size_bytes": 4635788
    },
    {
      "version": "14",
      "display_name": "v14 (14.24)",
      "is_lts": false,
      "is_eol": false,
      "is_latest": false,
      "release_date": "2021-09-30",
      "download_url": "https://github.com/falconwasplaying/coldmanual-db/raw/main/manuals/postgresql.tgz",
      "size_bytes": 4635788
    },
    {
      "version": "13",
      "display_name": "v13 (13.23)",
      "is_lts": false,
      "is_eol": true,
      "is_latest": false,
      "release_date": "2020-09-24",
      "download_url": "https://github.com/falconwasplaying/coldmanual-db/raw/main/manuals/postgresql.tgz",
      "size_bytes": 4635788
    },
    {
      "version": "12",
      "display_name": "v12 (12.22)",
      "is_lts": false,
      "is_eol": true,
      "is_latest": false,
      "release_date": "2019-10-03",
      "download_url": "https://github.com/falconwasplaying/coldmanual-db/raw/main/manuals/postgresql.tgz",
      "size_bytes": 4635788
    },
    {
      "version": "11",
      "display_name": "v11 (11.22)",
      "is_lts": false,
      "is_eol": true,
      "is_latest": false,
      "release_date": "2018-10-18",
      "download_url": "https://github.com/falconwasplaying/coldmanual-db/raw/main/manuals/postgresql.tgz",
      "size_bytes": 4635788
    },
    {
      "version": "10",
      "display_name": "v10 (10.23)",
      "is_lts": false,
      "is_eol": true,
      "is_latest": false,
      "release_date": "2017-10-05",
      "download_url": "https://github.com/falconwasplaying/coldmanual-db/raw/main/manuals/postgresql.tgz",
      "size_bytes": 4635788
    },
    {
      "version": "9.6",
      "display_name": "v9.6 (9.6.24)",
      "is_lts": false,
      "is_eol": true,
      "is_latest": false,
      "release_date": "2016-09-29",
      "download_url": "https://github.com/falconwasplaying/coldmanual-db/raw/main/manuals/postgresql.tgz",
      "size_bytes": 4635788
    },
    {
      "version": "9.5",
      "display_name": "v9.5 (9.5.25)",
      "is_lts": false,
      "is_eol": true,
      "is_latest": false,
      "release_date": "2016-01-07",
      "download_url": "https://github.com/falconwasplaying/coldmanual-db/raw/main/manuals/postgresql.tgz",
      "size_bytes": 4635788
    },
    {
      "version": "9.4",
      "display_name": "v9.4 (9.4.26)",
      "is_lts": false,
      "is_eol": true,
      "is_latest": false,
      "release_date": "2014-12-18",
      "download_url": "https://github.com/falconwasplaying/coldmanual-db/raw/main/manuals/postgresql.tgz",
      "size_bytes": 4635788
    },
    {
      "version": "9.3",
      "display_name": "v9.3 (9.3.25)",
      "is_lts": false,
      "is_eol": true,
      "is_latest": false,
      "release_date": "2013-09-09",
      "download_url": "https://github.com/falconwasplaying/coldmanual-db/raw/main/manuals/postgresql.tgz",
      "size_bytes": 4635788
    },
    {
      "version": "9.2",
      "display_name": "v9.2 (9.2.24)",
      "is_lts": false,
      "is_eol": true,
      "is_latest": false,
      "release_date": "2012-09-10",
      "download_url": "https://github.com/falconwasplaying/coldmanual-db/raw/main/manuals/postgresql.tgz",
      "size_bytes": 4635788
    },
    {
      "version": "9.1",
      "display_name": "v9.1 (9.1.24)",
      "is_lts": false,
      "is_eol": true,
      "is_latest": false,
      "release_date": "2011-09-12",
      "download_url": "https://github.com/falconwasplaying/coldmanual-db/raw/main/manuals/postgresql.tgz",
      "size_bytes": 4635788
    },
    {
      "version": "9.0",
      "display_name": "v9.0 (9.0.23)",
      "is_lts": false,
      "is_eol": true,
      "is_latest": false,
      "release_date": "2010-09-20",
      "download_url": "https://github.com/falconwasplaying/coldmanual-db/raw/main/manuals/postgresql.tgz",
      "size_bytes": 4635788
    },
    {
      "version": "8.4",
      "display_name": "v8.4 (8.4.22)",
      "is_lts": false,
      "is_eol": true,
      "is_latest": false,
      "release_date": "2009-07-01",
      "download_url": "https://github.com/falconwasplaying/coldmanual-db/raw/main/manuals/postgresql.tgz",
      "size_bytes": 4635788
    },
    {
      "version": "8.3",
      "display_name": "v8.3 (8.3.23)",
      "is_lts": false,
      "is_eol": true,
      "is_latest": false,
      "release_date": "2008-02-04",
      "download_url": "https://github.com/falconwasplaying/coldmanual-db/raw/main/manuals/postgresql.tgz",
      "size_bytes": 4635788
    },
    {
      "version": "8.2",
      "display_name": "v8.2 (8.2.23)",
      "is_lts": false,
      "is_eol": true,
      "is_latest": false,
      "release_date": "2006-12-05",
      "download_url": "https://github.com/falconwasplaying/coldmanual-db/raw/main/manuals/postgresql.tgz",
      "size_bytes": 4635788
    },
    {
      "version": "8.1",
      "display_name": "v8.1 (8.1.23)",
      "is_lts": false,
      "is_eol": true,
      "is_latest": false,
      "release_date": "2005-11-08",
      "download_url": "https://github.com/falconwasplaying/coldmanual-db/raw/main/manuals/postgresql.tgz",
      "size_bytes": 4635788
    },
    {
      "version": "8.0",
      "display_name": "v8.0 (8.0.26)",
      "is_lts": false,
      "is_eol": true,
      "is_latest": false,
      "release_date": "2005-01-19",
      "download_url": "https://github.com/falconwasplaying/coldmanual-db/raw/main/manuals/postgresql.tgz",
      "size_bytes": 4635788
    },
    {
      "version": "7.4",
      "display_name": "v7.4 (7.4.30)",
      "is_lts": false,
      "is_eol": true,
      "is_latest": false,
      "release_date": "2003-11-17",
      "download_url": "https://github.com/falconwasplaying/coldmanual-db/raw/main/manuals/postgresql.tgz",
      "size_bytes": 4635788
    },
    {
      "version": "7.3",
      "display_name": "v7.3 (7.3.21)",
      "is_lts": false,
      "is_eol": true,
      "is_latest": false,
      "release_date": "2002-11-27",
      "download_url": "https://github.com/falconwasplaying/coldmanual-db/raw/main/manuals/postgresql.tgz",
      "size_bytes": 4635788
    },
    {
      "version": "7.2",
      "display_name": "v7.2 (7.2.8)",
      "is_lts": false,
      "is_eol": true,
      "is_latest": false,
      "release_date": "2002-02-04",
      "download_url": "https://github.com/falconwasplaying/coldmanual-db/raw/main/manuals/postgresql.tgz",
      "size_bytes": 4635788
    },
    {
      "version": "7.1",
      "display_name": "v7.1 (7.1.3)",
      "is_lts": false,
      "is_eol": true,
      "is_latest": false,
      "release_date": "2001-04-13",
      "download_url": "https://github.com/falconwasplaying/coldmanual-db/raw/main/manuals/postgresql.tgz",
      "size_bytes": 4635788
    },
    {
      "version": "7.0",
      "display_name": "v7.0 (7.0.3)",
      "is_lts": false,
      "is_eol": true,
      "is_latest": false,
      "release_date": "2000-05-08",
      "download_url": "https://github.com/falconwasplaying/coldmanual-db/raw/main/manuals/postgresql.tgz",
      "size_bytes": 4635788
    },
    {
      "version": "6.5",
      "display_name": "v6.5 (6.5.3)",
      "is_lts": false,
      "is_eol": true,
      "is_latest": false,
      "release_date": "1999-06-09",
      "download_url": "https://github.com/falconwasplaying/coldmanual-db/raw/main/manuals/postgresql.tgz",
      "size_bytes": 4635788
    },
    {
      "version": "6.4",
      "display_name": "v6.4 (6.4.2)",
      "is_lts": false,
      "is_eol": true,
      "is_latest": false,
      "release_date": "1998-10-30",
      "download_url": "https://github.com/falconwasplaying/coldmanual-db/raw/main/manuals/postgresql.tgz",
      "size_bytes": 4635788
    },
    {
      "version": "6.3",
      "display_name": "v6.3 (6.3.2)",
      "is_lts": false,
      "is_eol": true,
      "is_latest": false,
      "release_date": "1998-03-01",
      "download_url": "https://github.com/falconwasplaying/coldmanual-db/raw/main/manuals/postgresql.tgz",
      "size_bytes": 4635788
    }
  ]
}
