{
  "id": "cpp",
  "name": "C++",
  "category": "Languages",
  "description": "High-performance general-purpose programming language with object-oriented and generic features (cppreference).",
  "icon": "cpp",
  "format": "dash",
  "latest_version": "26",
  "latest_lts_version": "23",
  "versions": [
    {
      "version": "26",
      "display_name": "C++26 (Working Draft)",
      "is_lts": false,
      "is_eol": false,
      "is_latest": true,
      "release_date": "2026",
      "download_url": "https://github.com/falconwasplaying/coldmanual-db/raw/main/manuals/cpp.tgz",
      "size_bytes": 173140596
    },
    {
      "version": "23",
      "display_name": "C++23 (ISO/IEC 14882:2024)",
      "is_lts": true,
      "is_eol": false,
      "is_latest": false,
      "release_date": "2024",
      "download_url": "https://github.com/falconwasplaying/coldmanual-db/raw/main/manuals/cpp.tgz",
      "size_bytes": 173140596
    },
    {
      "version": "20",
      "display_name": "C++20 (ISO/IEC 14882:2020)",
      "is_lts": true,
      "is_eol": false,
      "is_latest": false,
      "release_date": "2020",
      "download_url": "https://github.com/falconwasplaying/coldmanual-db/raw/main/manuals/cpp.tgz",
      "size_bytes": 173140596
    },
    {
      "version": "17",
      "display_name": "C++17 (ISO/IEC 14882:2017)",
      "is_lts": false,
      "is_eol": false,
      "is_latest": false,
      "release_date": "2017",
      "download_url": "https://github.com/falconwasplaying/coldmanual-db/raw/main/manuals/cpp.tgz",
      "size_bytes": 173140596
    },
    {
      "version": "14",
      "display_name": "C++14 (ISO/IEC 14882:2014)",
      "is_lts": false,
      "is_eol": true,
      "is_latest": false,
      "release_date": "2014",
      "download_url": "https://github.com/falconwasplaying/coldmanual-db/raw/main/manuals/cpp.tgz",
      "size_bytes": 173140596
    },
    {
      "version": "11",
      "display_name": "C++11 (ISO/IEC 14882:2011)",
      "is_lts": false,
      "is_eol": true,
      "is_latest": false,
      "release_date": "2011",
      "download_url": "https://github.com/falconwasplaying/coldmanual-db/raw/main/manuals/cpp.tgz",
      "size_bytes": 173140596
    }
  ]
}
